{
  "schema_version": "1.0",
  "institution_key": "cn-tongji",
  "institution_name": "Tongji University",
  "country_code": "cn",
  "target_intake": "2027",
  "research_date": "2026-10-20",
  "assignment": {
    "mode": "full",
    "gaps": [
      "full"
    ]
  },
  "coverage": {
    "scope": "listed",
    "programme_list_complete": false,
    "notes": "One-page official English-taught undergraduate catalogue currently lists three 2026 first-entry programmes (Civil Engineering International Class, Architecture International Class, MBBS). These are exhaustively enumerated for the accessible catalogue, but 2027 intake availability, campus and terms are not yet established; 2027 list completeness cannot be claimed. The general college-wide course/undergraduate catalogues are NOT additional English-taught degrees."
  },
  "institution": {
    "summary": "Public research university in Shanghai, China, with first-degree offerings in engineering, architecture and medicine.",
    "handoff_url": "https://study.tongji.edu.cn/en/ADMISSION/Undergraduate_Programs/Degree_programs_English_taught.htm"
  },
  "programmes": [
    {
      "id": "p01",
      "name": "Civil Engineering (International Class)",
      "existing_name": null,
      "credential": "Bachelor of Engineering",
      "campus": null,
      "language": "English",
      "duration_years": 4,
      "url": "https://study.tongji.edu.cn/en/info/1076/1232.htm",
      "about": "A four-year international-class Civil Engineering bachelor’s degree, covering structural and infrastructure engineering with English-language teaching.",
      "overview": "The college describes civil engineering training across buildings, bridges, underground structures, geotechnical engineering, railways, roads and disaster prevention. Its undergraduate teaching list includes English-language courses in structural mechanics, concrete structures and soil mechanics, although it does not confirm which modules are compulsory in the international class. The programme develops foundations for engineering design and problem-solving across built infrastructure. Applicants should check the specific international-class teaching plan."
    },
    {
      "id": "p02",
      "name": "Architecture (International Class)",
      "existing_name": null,
      "credential": "Bachelor of Engineering in Architecture",
      "campus": null,
      "language": "English",
      "duration_years": 4,
      "url": "https://study.tongji.edu.cn/en/info/1076/1234.htm",
      "about": "A four-year English-taught architecture degree blending architectural design studios, history and theory, construction technology and practical fieldwork.",
      "overview": "Students study design fundamentals and architectural design studios alongside architectural history, theory, and urban analysis. Technical teaching covers building construction, materials, physics, professional codes and disaster prevention. The published 2026 course outline includes art workshops, measured surveys of historic buildings and a final graduation design project. The exact sequencing of these elements should be confirmed against the curriculum issued for the student’s entry year."
    },
    {
      "id": "p03",
      "name": "Bachelor of Medicine and Bachelor of Surgery (MBBS)",
      "existing_name": null,
      "credential": "Bachelor of Medicine and Bachelor of Surgery (MBBS)",
      "campus": null,
      "language": "English (with compulsory Chinese-language study)",
      "duration_years": 6,
      "url": "https://study.tongji.edu.cn/en/info/1076/1233.htm",
      "about": "A six-year first-entry MBBS taught in English, combining biomedical science, clinical medicine, clinical placements and Chinese-language study.",
      "overview": "The programme begins with biomedical foundations including anatomy, physiology, biochemistry and pathology, followed by clinical disciplines such as internal medicine, surgery and paediatrics. The 2026 curriculum includes laboratory teaching, extended clinical practice, a graduation examination, Chinese language and professional Chinese courses. While the degree is advertised as English-taught, the working language of each clinical placement is not fully specified. Applicants should verify medical licensing and degree recognition in their intended country of practice."
    }
  ],
  "faculties": [],
  "claims": [
    {
      "id": "c001",
      "entity_id": "institution",
      "topic": "identity",
      "status": "supported",
      "statement": "Tongji University is a comprehensive research university overseen by China’s Ministry of Education, based in Shanghai. Its international student admissions office provides the official English-taught degree listing.",
      "value": null,
      "applies_to": {
        "intake": null,
        "applicant_group": "All prospective international undergraduates",
        "programme_ids": [],
        "fee_status": null
      },
      "evidence": [
        {
          "source_id": "s02",
          "locator": "University Overview, paragraphs 1–4",
          "excerpt": null,
          "supports": "Identifies Tongji as a ministry-administered research university founded in Shanghai; recounts core academic disciplines."
        },
        {
          "source_id": "s01",
          "locator": "Admission > Undergraduate Programs > Degree programs-English taught",
          "excerpt": null,
          "supports": "Provides targeted official international-undergraduate catalogue and navigational handoff."
        }
      ],
      "supports_paths": [
        "/institution/summary",
        "/institution/handoff_url"
      ],
      "notes": null
    },
    {
      "id": "c002",
      "entity_id": "institution",
      "topic": "scope",
      "status": "historical",
      "statement": "The official English-taught international undergraduate listing contains three entries for the 2026 cycle: Civil Engineering (International Class), Architecture (International Class), and the six-year MBBS. Its pagination indicates one page, not a larger available list. Availability in autumn 2027 is not yet verified.",
      "value": null,
      "applies_to": {
        "intake": "2026",
        "applicant_group": "International applicants to English-taught first degrees",
        "programme_ids": [],
        "fee_status": null
      },
      "evidence": [
        {
          "source_id": "s01",
          "locator": "English-taught undergraduate listing, three article links, pagination 1/1",
          "excerpt": null,
          "supports": "Lists precisely Civil Engineering, MBBS and Architecture, with one catalogue page."
        },
        {
          "source_id": "s03",
          "locator": "Civil Engineering (International Class), dated 13 Nov 2025",
          "excerpt": null,
          "supports": "Identifies the listed civil international class."
        },
        {
          "source_id": "s06",
          "locator": "Architecture (International Class), dated 13 Nov 2025",
          "excerpt": null,
          "supports": "Identifies the listed architecture international class."
        },
        {
          "source_id": "s08",
          "locator": "MBBS programme, dated 13 Nov 2025",
          "excerpt": null,
          "supports": "Identifies the listed MBBS route."
        }
      ],
      "supports_paths": [],
      "notes": "Checked the complete 1/1 English-taught undergraduate listing and college admissions table; 2027 list has not been located."
    },
    {
      "id": "c003",
      "entity_id": "p01",
      "topic": "programme",
      "status": "historical",
      "statement": "Tongji’s 2026 international-undergraduate catalogue offers Civil Engineering (International Class); the College of Civil Engineering describes the English-taught civil bachelor route as four years and the award as Bachelor of Engineering.",
      "value": null,
      "applies_to": {
        "intake": "2026",
        "applicant_group": "International first-year undergraduate applicants",
        "programme_ids": [
          "p01"
        ],
        "fee_status": null
      },
      "evidence": [
        {
          "source_id": "s03",
          "locator": "Page title and 2025-11-13 timestamp",
          "excerpt": null,
          "supports": "The international civil engineering class is a named first-degree programme."
        },
        {
          "source_id": "s05",
          "locator": "Available Programs, Undergraduate Programs row",
          "excerpt": null,
          "supports": "Civil Engineering listed under Chinese / English instruction and four-year duration."
        },
        {
          "source_id": "s04",
          "locator": "Undergraduate, opening paragraph",
          "excerpt": null,
          "supports": "Civil engineering bachelor graduates receive the Bachelor of Engineering and study for four years."
        }
      ],
      "supports_paths": [
        "/programmes/0/name",
        "/programmes/0/credential",
        "/programmes/0/language",
        "/programmes/0/duration_years",
        "/programmes/0/url"
      ],
      "notes": null
    },
    {
      "id": "c004",
      "entity_id": "p01",
      "topic": "description",
      "status": "supported",
      "statement": "The civil undergraduate syllabus spans structural, subterranean, geotechnical, transport and disaster-related engineering; the faculty additionally publishes a separate set of English undergraduate modules, without certifying a class-specific required-module map.",
      "value": null,
      "applies_to": {
        "intake": null,
        "applicant_group": "Prospective international Civil Engineering students",
        "programme_ids": [
          "p01"
        ],
        "fee_status": null
      },
      "evidence": [
        {
          "source_id": "s04",
          "locator": "Civil Engineering subsection; English Course for Undergraduate Students table",
          "excerpt": null,